[
  {
    "name": "Paris",
    "longitude": 2.3522,
    "latitude": 48.8566,
    "population": 2148000,
    "average_airfare_price_usd": 800,
    "average_hotel_price_usd": 200,
    "top_5_things_to_do": [
      "Visit the Eiffel Tower",
      "Explore the Louvre Museum",
      "Stroll along the Seine River",
      "Climb the steps to Sacré-Cœur Basilica",
      "Discover Montmartre neighborhood"
    ]
  },
  {
    "name": "Tokyo",
    "longitude": 139.6917,
    "latitude": 35.6895,
    "population": 13929286,
    "average_airfare_price_usd": 1000,
    "average_hotel_price_usd": 150,
    "top_5_things_to_do": [
      "Visit the historic Senso-ji Temple",
      "Explore the bustling streets of Shibuya",
      "Experience traditional tea ceremony",
      "Discover the beauty of Meiji Shrine",
      "Enjoy the panoramic view from Tokyo Tower"
    ]
  },
  {
    "name": "New York City",
    "longitude": -74.006,
    "latitude": 40.7128,
    "population": 8398748,
    "average_airfare_price_usd": 700,
    "average_hotel_price_usd": 250,
    "top_5_things_to_do": [
      "Walk through Central Park",
      "Visit the Statue of Liberty",
      "Explore Times Square",
      "Experience the views from the Empire State Building",
      "Enjoy Broadway shows"
    ]
  },
  {
    "name": "London",
    "longitude": -0.1276,
    "latitude": 51.5074,
    "population": 9304016,
    "average_airfare_price_usd": 900,
    "average_hotel_price_usd": 180,
    "top_5_things_to_do": [
      "Visit the British Museum",
      "Explore the Tower of London",
      "Take a ride on the London Eye",
      "Stroll through Hyde Park",
      "Discover the nightlife in Soho"
    ]
  },
  {
    "name": "Rome",
    "longitude": 12.4964,
    "latitude": 41.9028,
    "population": 2872800,
    "average_airfare_price_usd": 850,
    "average_hotel_price_usd": 170,
    "top_5_things_to_do": [
      "Visit the Colosseum",
      "Explore Vatican City and St. Peter's Basilica",
      "Throw a coin in the Trevi Fountain",
      "Discover the Roman Forum",
      "Indulge in Italian cuisine in Trastevere"
    ]
  },
  {
    "name": "Bangkok",
    "longitude": 100.5018,
    "latitude": 13.7563,
    "population": 8280925,
    "average_airfare_price_usd": 600,
    "average_hotel_price_usd": 80,
    "top_5_things_to_do": [
      "Explore the Grand Palace",
      "Visit Wat Arun",
      "Take a boat ride along the Chao Phraya River",
      "Shop at Chatuchak Weekend Market",
      "Experience vibrant nightlife in Khao San Road"
    ]
  },
  {
    "name": "Istanbul",
    "longitude": 28.9784,
    "latitude": 41.0082,
    "population": 15460000,
    "average_airfare_price_usd": 750,
    "average_hotel_price_usd": 120,
    "top_5_things_to_do": [
      "Explore the Hagia Sophia",
      "Visit the Blue Mosque",
      "Discover Topkapi Palace",
      "Shop at the Grand Bazaar",
      "Take a cruise on the Bosphorus"
    ]
  },
  {
    "name": "Dubai",
    "longitude": 55.2708,
    "latitude": 25.2048,
    "population": 3137000,
    "average_airfare_price_usd": 900,
    "average_hotel_price_usd": 150,
    "top_5_things_to_do": [
      "Visit the Burj Khalifa",
      "Experience the Dubai Fountain",
      "Explore the Dubai Mall",
      "Take a desert safari",
      "Relax at Jumeirah Beach"
    ]
  },
  {
    "name": "Barcelona",
    "longitude": 2.1734,
    "latitude": 41.3851,
    "population": 1664182,
    "average_airfare_price_usd": 750,
    "average_hotel_price_usd": 160,
    "top_5_things_to_do": [
      "Visit the Sagrada Familia",
      "Explore Park Güell",
      "Stroll along La Rambla",
      "Discover the Gothic Quarter",
      "Relax on the beaches of Barceloneta"
    ]
  },
  {
    "name": "Sydney",
    "longitude": 151.2093,
    "latitude": -33.8688,
    "population": 5312163,
    "average_airfare_price_usd": 1100,
    "average_hotel_price_usd": 200,
    "top_5_things_to_do": [
      "Climb the Sydney Harbour Bridge",
      "Visit the Sydney Opera House",
      "Relax at Bondi Beach",
      "Explore the Royal Botanic Garden",
      "Take a ferry ride to Manly Beach"
    ]
  },
  {
    "name": "Amsterdam",
    "longitude": 4.8952,
    "latitude": 52.3702,
    "population": 860124,
    "average_airfare_price_usd": 800,
    "average_hotel_price_usd": 170,
    "top_5_things_to_do": [
      "Explore the Van Gogh Museum",
      "Take a canal cruise",
      "Visit the Anne Frank House",
      "Discover the Rijksmuseum",
      "Experience the nightlife in the Red Light District"
    ]
  },
  {
    "name": "Los Angeles",
    "longitude": -118.2437,
    "latitude": 34.0522,
    "population": 3990456,
    "average_airfare_price_usd": 650,
    "average_hotel_price_usd": 180,
    "top_5_things_to_do": [
      "Visit the Hollywood Walk of Fame",
      "Explore Universal Studios Hollywood",
      "Relax at Santa Monica Pier",
      "Discover Griffith Observatory",
      "Shop on Rodeo Drive"
    ]
  },
  {
    "name": "Hong Kong",
    "longitude": 114.1694,
    "latitude": 22.3193,
    "population": 7392000,
    "average_airfare_price_usd": 850,
    "average_hotel_price_usd": 140,
    "top_5_things_to_do": [
      "Take the Peak Tram to Victoria Peak",
      "Explore the markets of Mong Kok",
      "Visit Tian Tan Buddha on Lantau Island",
      "Enjoy the nightlife in Lan Kwai Fong",
      "Discover the street food in Temple Street Night Market"
    ]
  },
  {
    "name": "Singapore",
    "longitude": 103.8198,
    "latitude": 1.3521,
    "population": 5704000,
    "average_airfare_price_usd": 900,
    "average_hotel_price_usd": 160,
    "top_5_things_to_do": [
      "Explore Gardens by the Bay",
      "Visit Marina Bay Sands",
      "Discover Sentosa Island",
      "Explore Chinatown",
      "Experience the Singapore Zoo"
    ]
  },
  {
    "name": "Venice",
    "longitude": 12.3155,
    "latitude": 45.4408,
    "population": 261905,
    "average_airfare_price_usd": 850,
    "average_hotel_price_usd": 200,
    "top_5_things_to_do": [
      "Take a gondola ride along the canals",
      "Explore St. Mark's Basilica",
      "Visit Doge's Palace",
      "Discover the Rialto Bridge",
      "Enjoy the atmosphere of Piazza San Marco"
    ]
  },
  {
    "name": "San Francisco",
    "longitude": -122.4194,
    "latitude": 37.7749,
    "population": 884363,
    "average_airfare_price_usd": 700,
    "average_hotel_price_usd": 220,
    "top_5_things_to_do": [
      "Walk across the Golden Gate Bridge",
      "Visit Alcatraz Island",
      "Explore Fisherman's Wharf",
      "Ride a cable car",
      "Discover Golden Gate Park"
    ]
  },
  {
    "name": "Vienna",
    "longitude": 16.3738,
    "latitude": 48.2082,
    "population": 1911728,
    "average_airfare_price_usd": 800,
    "average_hotel_price_usd": 150,
    "top_5_things_to_do": [
      "Visit Schönbrunn Palace",
      "Explore Belvedere Palace",
      "Discover St. Stephen's Cathedral",
      "Enjoy a performance at the Vienna State Opera",
      "Take a stroll through the historic city center"
    ]
  },
  {
    "name": "Las Vegas",
    "longitude": -115.1398,
    "latitude": 36.1699,
    "population": 651319,
    "average_airfare_price_usd": 500,
    "average_hotel_price_usd": 120,
    "top_5_things_to_do": [
      "Experience the Las Vegas Strip",
      "Visit iconic hotels and casinos",
      "Watch a spectacular show",
      "Explore Fremont Street",
      "Take a helicopter tour of the Grand Canyon"
    ]
  },
  {
    "name": "Florence",
    "longitude": 11.2558,
    "latitude": 43.7696,
    "population": 383083,
    "average_airfare_price_usd": 850,
    "average_hotel_price_usd": 180,
    "top_5_things_to_do": [
      "Visit the Uffizi Gallery",
      "Explore the Florence Cathedral (Duomo)",
      "Discover the Ponte Vecchio",
      "Stroll through Piazza della Signoria",
      "Experience the beauty of Boboli Gardens"
    ]
  },
  {
    "name": "Marrakech",
    "longitude": -7.5898,
    "latitude": 31.6295,
    "population": 1062000,
    "average_airfare_price_usd": 600,
    "average_hotel_price_usd": 80,
    "top_5_things_to_do": [
      "Explore Jardin Majorelle",
      "Discover the bustling Medina",
      "Visit Bahia Palace",
      "Experience Jemaa el-Fnaa square",
      "Relax in a traditional hammam"
    ]
  },
  {
    "name": "Prague",
    "longitude": 14.4378,
    "latitude": 50.0755,
    "population": 1309000,
    "average_airfare_price_usd": 750,
    "average_hotel_price_usd": 130,
    "top_5_things_to_do": [
      "Explore Prague Castle",
      "Visit Charles Bridge",
      "Discover Old Town Square",
      "Enjoy the view from Petřín Hill",
      "Experience Czech cuisine and beer"
    ]
  },
  {
    "name": "Budapest",
    "longitude": 19.0402,
    "latitude": 47.4979,
    "population": 1752286,
    "average_airfare_price_usd": 700,
    "average_hotel_price_usd": 120,
    "top_5_things_to_do": [
      "Relax in the Széchenyi Thermal Bath",
      "Visit Buda Castle",
      "Take a cruise on the Danube River",
      "Discover Fisherman's Bastion",
      "Explore the Great Market Hall"
    ]
  },
  {
    "name": "Seoul",
    "longitude": 126.978,
    "latitude": 37.5665,
    "population": 9720846,
    "average_airfare_price_usd": 800,
    "average_hotel_price_usd": 100,
    "top_5_things_to_do": [
      "Explore Gyeongbokgung Palace",
      "Visit Bukchon Hanok Village",
      "Discover Myeongdong shopping district",
      "Hike up Namsan Mountain",
      "Experience traditional Korean cuisine"
    ]
  },
  {
    "name": "Cairo",
    "longitude": 31.2357,
    "latitude": 30.0444,
    "population": 20484900,
    "average_airfare_price_usd": 600,
    "average_hotel_price_usd": 70,
    "top_5_things_to_do": [
      "Visit the Pyramids of Giza",
      "Explore the Egyptian Museum",
      "Discover Khan el-Khalili market",
      "Explore the Citadel of Cairo",
      "Sail on a felucca along the Nile River"
    ]
  },
  {
    "name": "Mexico City",
    "longitude": -99.1332,
    "latitude": 19.4326,